{
  "answer_ambiguity": true,
  "context_appropriateness": null,
  "dialogue_coherence": null,
  "lexical_cefr_appropriate": true,
  "natural_speaker_turns": null,
  "naturalness": 5,
  "note": "Natural, simple standalone sentence with accessible vocabulary. The blank permits several plausible completions (e.g., past simple or other cooking verbs), so the expected response is not uniquely determined by the visible prompt.",
  "pedagogical_suitability": 4,
  "pragmatic_licensing": null,
  "world_knowledge_required": false
}
