{
  "answer_ambiguity": false,
  "context_appropriateness": 5,
  "dialogue_coherence": 5,
  "lexical_cefr_appropriate": true,
  "natural_speaker_turns": 5,
  "naturalness": 5,
  "note": "Natural, clear kitchen-context dialogue; the response fits exactly.",
  "pedagogical_suitability": 5,
  "pragmatic_licensing": 5,
  "world_knowledge_required": false
}
